Sentence,Category,Spacy
" com/message/make-the-most-of-your-day-351b6e631e0c ""How Do We Mourn on Social Media?"" by Bethanne Patrick in The Mid: http://www.",H0,"[[89, 97, 'H0'], [98, 105, 'H0']]"
 themid.,None,[]
 com/relationships/mourning-on-social-media?u=5q3XdQ6EYGKeller Controversy Emma Keller's original Guardian piece: https://www.,H0,"[[74, 78, 'H0'], [79, 87, 'H0']]"
 theguardian.,None,[]
 com/commentisfree/2014/jan/08/lisa-adams-tweeting-cancer-ethics Emma Keller resigns from Guardian: https://web.,H0,"[[64, 68, 'H0'], [69, 75, 'H0']]"
 archive.,None,[]
 org/web/20150331034821/http://www.,None,[]
 poynter.,None,[]
 org/news/mediawire/249191/emma-gilbey-keller-has-resigned-from-the-guardian/ HuffPo on Keller controversy: http://www.,H0,"[[87, 93, 'H0']]"
 huffingtonpost.,None,[]
 com/2014/01/13/bill-keller-cancer-victim-op-ed_n_4588454.,None,[]
 html Keller's piece: https://www.,H0,"[[5, 13, 'H0']]"
 nytimes.,None,[]
 com/2014/01/13/opinion/keller-heroic-measures.,None,[]
 html New Yorker coverage: http://www.,None,[]
 newyorker.,None,[]
 com/culture/culture-desk/tweeting-cancerAlso: Lisa's website and blog: http://lisabadams.,H0,"[[46, 52, 'H0']]"
 com/ Lisa's twitter: https://twitter.,H0,"[[5, 11, 'H0']]"
 Ashley Phillip Adams (12 October 1955 – 17 March 2015) was an Australian Paralympic shooting medallist and cattle grazier.,H0,"[[0, 6, 'H0'], [7, 14, 'H0'], [15, 20, 'H0'], [21, 24, 'H1'], [25, 32, 'H1'], [33, 37, 'H1'], [38, 39, 'H1'], [40, 42, 'H1'], [43, 48, 'H1'], [49, 54, 'H1'], [62, 72, 'H1']]"
 Adams was born on 12 October 1955 in Toowoomba.,H0,"[[0, 5, 'H0'], [18, 20, 'H1'], [21, 28, 'H1'], [29, 33, 'H1'], [37, 47, 'H1']]"
" He became a paraplegic in 1982 at the age of 26 after being involved in an accident at a local motorbike competition, where he fell off his motorbike and broke his back.",H1,"[[12, 22, 'H1'], [154, 159, 'H1'], [160, 163, 'H1'], [164, 169, 'H1']]"
" Following his accident, he underwent a six-month period of rehabilitation.",None,[]
" He was a cattle grazier who owned a 64,000-acre (26,000 ha) station near Blackall, Queensland.",None,[]
" He made extensive modifications to the station's infrastructure to improve his access to the land, including the installation of gates that open both ways.",None,[]
" He produced TendaBeef, and supported the genetic breeding of cattle.",None,[]
 Adams died on 17 March 2015 after a quad bike accident on his farm.,H0,"[[0, 5, 'H0'], [14, 16, 'H1'], [17, 22, 'H1'], [23, 27, 'H1']]"
 He was 59.,H1,"[[7, 10, 'H1']]"
 Adams was a competitive sport shooter.,H0,"[[0, 5, 'H0']]"
" He started shooting competitively in 1993, after some previous experience with shooting working on farms.",None,[]
" Events he competed in included R3 Mixed Air Rifle Prone, R1 Men's 10m Air Rifle Standing, R6 Mixed 50m Free Rifle Prone and R7 Free Rifle 3x40 50m.",None,[]
" When he competed in club-based events, he represented the Charleville Small Bore Rifle Club.",None,[]
" He shot from a prone position on the ground similar to that of Olympic competitors, instead of a prone position in his wheelchair.",H1,"[[84, 91, 'H1'], [92, 94, 'H1'], [95, 96, 'H1'], [97, 102, 'H1'], [103, 111, 'H1'], [112, 114, 'H1'], [115, 118, 'H1'], [119, 130, 'H1']]"
 He had an Australian Institute of Sport scholarship from 1998 to 2000.,None,[]
" In 1998, Adams set a world record at the English Match.",H0,"[[9, 14, 'H0']]"
 He finished first at the Swiss Open in 2002 and 2003.,None,[]
" In 2007, he won a gold medal and a bronze medal at the Korean Cup.",None,[]
" That same year, he finished first at the Australian Open Able-body Prone National Championship.",None,[]
" In 2011, he competed in ISSF World Cup events in Turkey and Spain, where he finished first in the Spanish .",None,[]
 22 event and second in the Turkish air rifle event.,None,[]
" In Spain, he also picked up fourth place in the men's R7 50m rifle 3 position SH1 event and seventh in the R1 10m air rifle SH1 event.",None,[]
" In 2011, he was ranked first in the world in two different shooting events.",None,[]
" In that year, he was also ranked as one of the top able-bodied open shooters in Australia.",None,[]
 He was ranked in the top ten in the world for three events at the end of 2014.,None,[]
 Adams first represented Australia at an international level in the 1996 Atlanta Paralympics.,H0,"[[0, 5, 'H0']]"
" He went on to compete at the 2000 Sydney, 2004 Athens, 2008 Beijing and 2012 London Paralympics.",None,[]
" at the 2004 Athens Games, he won a silver medal in the Mixed Free Rifle Prone SH1 event and a bronze medal in the Men's Air Rifle Standing SH1 event.",None,[]
" At the 2008 Beijing Games, he finished fourth in both the 10 m air rifle standing event the 50 m free rifle prone events.",None,[]
 He finished in the top twenty in all four of his events at the 2012 London Games.,None,[]
 Adams was recognised several times for his sporting accomplishments.,H1,"[[0, 5, 'H1']]"
 He won a Merit Award given out by the Australian Paralympic Committee.,None,[]
 He twice won the Male Athlete Senior Sporting Wheelies Award and received an Australian Sports Medal in 2000.,None,[]
" Arlin Marvin Adams (April 16, 1921 – December 22, 2015) was a United States Circuit Judge of the United States Court of Appeals for the Third Circuit.",H0,"[[0, 5, 'H0'], [6, 12, 'H0'], [13, 18, 'H0'], [19, 25, 'H1'], [26, 29, 'H1'], [30, 34, 'H1'], [35, 36, 'H1'], [37, 45, 'H1'], [46, 49, 'H1'], [50, 55, 'H1'], [62, 68, 'H1'], [69, 75, 'H1'], [76, 83, 'H1'], [84, 89, 'H1'], [90, 92, 'H1'], [93, 96, 'H1'], [97, 103, 'H1'], [104, 110, 'H1'], [111, 116, 'H1'], [117, 119, 'H1'], [120, 127, 'H1'], [128, 131, 'H1'], [132, 135, 'H1'], [136, 141, 'H1'], [142, 150, 'H1']]"
" As late as 2013 he served as counsel to Schnader Harrison Segal & Lewis LLP, and was listed as a NAFTA adjudicator.",H1,"[[29, 36, 'H1'], [37, 39, 'H1'], [40, 48, 'H1'], [49, 57, 'H1'], [58, 63, 'H1'], [64, 65, 'H1'], [66, 71, 'H1'], [72, 76, 'H1'], [97, 102, 'H1'], [103, 115, 'H1']]"
" Born in Philadelphia, Pennsylvania, Adams earned a Bachelor of Science degree in 1941 from Temple University, a Bachelor of Laws from the University of Pennsylvania Law School in 1947, and a Master of Arts degree from Temple in 1950.",H0,"[[8, 21, 'H1'], [22, 35, 'H1'], [36, 41, 'H0'], [51, 59, 'H1'], [60, 62, 'H1'], [63, 70, 'H1'], [71, 77, 'H1'], [91, 97, 'H1'], [98, 109, 'H1'], [112, 120, 'H1'], [121, 123, 'H1'], [124, 128, 'H1'], [138, 148, 'H1'], [149, 151, 'H1'], [152, 164, 'H1'], [165, 168, 'H1'], [169, 175, 'H1'], [191, 197, 'H1'], [198, 200, 'H1'], [201, 205, 'H1'], [206, 212, 'H1'], [218, 224, 'H1']]"
" While at Penn, he served as editor-in-chief of the law review.",H1,"[[9, 14, 'H1'], [28, 43, 'H1'], [44, 46, 'H1'], [47, 50, 'H1'], [51, 54, 'H1'], [55, 62, 'H1']]"
 Adams worked in private legal practice in Philadelphia from 1947 until 1969.,H0,"[[0, 5, 'H0']]"
 He also was a member of the faculty of the University of Pennsylvania from 1952 until 1956.,H1,"[[28, 35, 'H1'], [36, 38, 'H1'], [39, 42, 'H1'], [43, 53, 'H1'], [54, 56, 'H1'], [57, 69, 'H1']]"
 He was a secretary of public welfare for the Commonwealth of Pennsylvania from 1963 to 1966.,H1,"[[9, 18, 'H1'], [19, 21, 'H1'], [22, 28, 'H1'], [29, 36, 'H1'], [37, 40, 'H1'], [41, 44, 'H1'], [45, 57, 'H1'], [58, 60, 'H1'], [61, 73, 'H1']]"
" On September 22, 1969 President Richard Nixon nominated Adams to a seat on the United States Court of Appeals for the Third Circuit that had been vacated by the decision by Judge Harry Ellis Kalodner to take senior status.",H0,"[[22, 31, 'H0'], [32, 39, 'H0'], [40, 45, 'H0'], [56, 61, 'H0'], [79, 85, 'H1'], [86, 92, 'H1'], [93, 98, 'H1'], [99, 101, 'H1'], [102, 109, 'H1'], [110, 113, 'H1'], [114, 117, 'H1'], [118, 123, 'H1'], [124, 131, 'H1'], [173, 178, 'H1'], [179, 184, 'H0'], [185, 190, 'H0'], [191, 199, 'H0']]"
" The United States Senate confirmed Adams on October 1, 1969, and he received his commission on October 2, 1969.",H0,"[[0, 3, 'H1'], [4, 10, 'H1'], [11, 17, 'H1'], [18, 24, 'H1'], [25, 34, 'H1'], [35, 40, 'H0']]"
" In 1971, President Richard Nixon came close to nominating Adams to the Supreme Court of the United States, but nominated William Rehnquist instead after the Third Circuit, in an opinion written by Adams, reversed the convictions of several nuns involved in an anti-Vietnam War protest.",H0,"[[9, 18, 'H0'], [19, 26, 'H0'], [27, 32, 'H0'], [58, 63, 'H0'], [71, 78, 'H1'], [79, 84, 'H1'], [85, 87, 'H1'], [88, 91, 'H1'], [92, 98, 'H1'], [99, 106, 'H1'], [121, 128, 'H0'], [129, 138, 'H0'], [157, 162, 'H1'], [163, 171, 'H1'], [197, 203, 'H0']]"
 In 1975 Adams was considered by President Gerald Ford as a nominee to the Supreme Court of the United States.,H0,"[[8, 13, 'H0'], [32, 41, 'H0'], [42, 48, 'H0'], [49, 53, 'H0'], [74, 81, 'H1'], [82, 87, 'H1'], [88, 90, 'H1'], [91, 94, 'H1'], [95, 101, 'H1'], [102, 109, 'H1']]"
" Adams was one of two finalists; Ford ultimately wound up successfully nominating the other finalist, John Paul Stevens.",H0,"[[0, 5, 'H0'], [32, 36, 'H0'], [101, 105, 'H0'], [106, 110, 'H0'], [111, 119, 'H0']]"
" Adams retired outright from the bench (rather than taking senior status) on January 2, 1987.",H0,"[[0, 5, 'H0']]"
" He returned to private practice, joining the firm Schnader Harrison Segal & Lewis LLP.",H1,"[[50, 58, 'H1'], [59, 67, 'H1'], [68, 73, 'H1'], [74, 75, 'H1'], [76, 81, 'H1'], [82, 86, 'H1']]"
 Adams was well known for his post-judiciary roles in significant legal cases.,H0,"[[0, 5, 'H0']]"
" In 1994, he conducted an investigation of the Pennsylvania attorney general for alleged criminal activity, and investigated allegations of improper medical research at Fox Chase Cancer Center.",None,[]
" Soon after in 1995, he was appointed to serve as a trustee in the New Era bankruptcy case, at that time the largest nonprofit bankruptcy in history.",H1,"[[51, 58, 'H1'], [59, 61, 'H1'], [62, 65, 'H1'], [66, 69, 'H1'], [70, 73, 'H1'], [74, 84, 'H1']]"
 He also served as the Chapter 11 Trustee in the successful reorganization of the Coram Healthcare Corporation in the Bankruptcy Court in Delaware.,H1,"[[22, 29, 'H1'], [30, 32, 'H1'], [33, 40, 'H1']]"
 He was elected a Fellow of the American Academy of Arts and Sciences in 1996.,H1,"[[17, 23, 'H1'], [24, 26, 'H1'], [27, 30, 'H1'], [31, 39, 'H1'], [40, 47, 'H1'], [48, 50, 'H1'], [51, 55, 'H1'], [56, 59, 'H1'], [60, 68, 'H1']]"
" From 1998 to 2002, Adams served as independent counsel in an investigation of the U.",H0,"[[19, 24, 'H0'], [35, 46, 'H1'], [47, 54, 'H1'], [82, 84, 'H1']]"
 S.,H1,"[[0, 2, 'H1']]"
 Department of Housing and Urban Development that uncovered widespread corruption.,H1,"[[0, 10, 'H1'], [11, 13, 'H1'], [14, 21, 'H1'], [22, 25, 'H1'], [26, 31, 'H1'], [32, 43, 'H1']]"
 Adams service to society includes both legal and community capacities.,H0,"[[0, 5, 'H0']]"
" Adams was a member of the Board of the Pennsylvania, and had previously served as a member of the board and Chairman of Albert Einstein Healthcare Network, trustee for the William Penn Foundation, the National Constitution Center, and Bryn Mawr College and President of the congregation for Reform Congregation Keneseth Israel.",H0,"[[0, 5, 'H0'], [26, 31, 'H1'], [32, 34, 'H1'], [35, 38, 'H1'], [39, 52, 'H1'], [84, 90, 'H1'], [91, 93, 'H1'], [94, 97, 'H1'], [98, 103, 'H1'], [108, 116, 'H1'], [120, 126, 'H1'], [127, 135, 'H1'], [136, 146, 'H1'], [147, 155, 'H1'], [156, 163, 'H1'], [172, 179, 'H1'], [180, 184, 'H1'], [185, 196, 'H1'], [201, 209, 'H1'], [210, 222, 'H1'], [223, 230, 'H1'], [231, 234, 'H1'], [235, 239, 'H1'], [240, 244, 'H1'], [245, 252, 'H1'], [257, 266, 'H1'], [267, 269, 'H1'], [270, 273, 'H1'], [274, 286, 'H1'], [287, 290, 'H1'], [291, 297, 'H1'], [298, 310, 'H1'], [311, 319, 'H1'], [320, 327, 'H1']]"
 He was a former chancellor of the Philadelphia Bar Association and past president of both the American Judicature Society and American Philosophical Society.,H1,"[[16, 26, 'H1'], [27, 29, 'H1'], [30, 33, 'H1'], [34, 46, 'H1'], [47, 50, 'H1'], [51, 62, 'H1'], [72, 81, 'H1'], [94, 102, 'H1'], [103, 113, 'H1'], [114, 121, 'H1'], [126, 134, 'H1'], [135, 148, 'H1'], [149, 157, 'H1']]"
 He also was the former chair of the U.,H1,"[[23, 28, 'H1'], [36, 38, 'H1']]"
 S.,H1,"[[0, 2, 'H1']]"
 Supreme Court Judicial Fellows Commission.,H1,"[[0, 7, 'H1'], [8, 13, 'H1'], [14, 22, 'H1'], [23, 30, 'H1'], [31, 42, 'H1']]"
 He also briefly served as a co-trustee of the Roosevelt-Bentman Trust for American Voters.,H1,"[[28, 38, 'H1'], [46, 63, 'H1'], [64, 69, 'H1'], [70, 73, 'H1'], [74, 82, 'H1'], [83, 90, 'H1']]"
" In 2001, Susquehanna University created the Arlin M.",H0,"[[44, 49, 'H0'], [50, 52, 'H0']]"
" Adams Center for Law and Society, and in 2005, with the support of the Annenberg Foundation, the University of Pennsylvania Law School established the Arlin M.",H0,"[[0, 5, 'H0'], [151, 156, 'H0'], [157, 159, 'H0']]"
 Adams Professorship in Constitutional Law.,H0,"[[0, 5, 'H0']]"
 The Drexel University School of Law established the Arlin M.,H0,"[[52, 57, 'H0'], [58, 60, 'H0']]"
 Adams Professor of Legal Writing position in 2007 to recognize Adams' long career as a lawyer and judge.,H0,"[[0, 5, 'H0'], [63, 69, 'H0']]"
" Nation Dedicated to Religious Liberty: The Constitutional Heritage of the Religion Clauses, Arlin M.",H0,"[[92, 97, 'H0'], [98, 100, 'H0']]"
" Adams, Charles J.",H0,"[[0, 6, 'H0'], [7, 14, 'H0'], [15, 17, 'H0']]"
" Emmerich, Warren E.",H0,"[[0, 9, 'H0'], [10, 16, 'H0'], [17, 19, 'H0']]"
" Burger (University of Pennsylvania Press, August 1990) Religion and the Public Good: A Bicentennial Forum , William Lee Miller, Martin E.",H0,"[[0, 6, 'H0'], [108, 115, 'H0'], [116, 119, 'H0'], [120, 127, 'H0'], [128, 134, 'H0'], [135, 137, 'H0']]"
" Marty, Arlin M.",H0,"[[0, 6, 'H0'], [7, 12, 'H0'], [13, 15, 'H0']]"
" Adams (Mercer University Press, March 1989) Gerald Ford Supreme Court candidates Arlin Marvin Adams at the Biographical Directory of Federal Judges, a public domain publication of the Federal Judicial Center.",H0,"[[0, 5, 'H0'], [44, 50, 'H0'], [51, 55, 'H0'], [81, 86, 'H0'], [87, 93, 'H0'], [94, 99, 'H0']]"
 Professional Biography on Schnader Harrison website Arlin M.,H0,"[[26, 34, 'H0'], [35, 43, 'H0'], [52, 57, 'H0'], [58, 60, 'H0']]"
 Adams listing on Martindale-Hubbell Interview with Arlin M.,H0,"[[0, 5, 'H0'], [51, 56, 'H0'], [57, 59, 'H0']]"
 Adams conducted as part of the Oral Legal History Project at the University of Pennsylvania Law School Arlin M.,H0,"[[0, 5, 'H0'], [103, 108, 'H0'], [109, 111, 'H0']]"
 Alvin Philip Adams Jr.,H0,"[[0, 5, 'H0'], [6, 12, 'H0'], [13, 18, 'H0'], [19, 22, 'H0']]"
" (August 29, 1942 – October 10, 2015) was an American diplomat.",H1,"[[0, 7, 'H1'], [8, 11, 'H1'], [12, 16, 'H1'], [17, 18, 'H1'], [19, 26, 'H1'], [27, 30, 'H1'], [31, 36, 'H1'], [44, 52, 'H1']]"
" Born in New York City, he was one of three children born to Elizabeth Miller, daughter of Nathan L.",H0,"[[8, 11, 'H1'], [12, 16, 'H1'], [17, 22, 'H1'], [60, 69, 'H0'], [70, 77, 'H0'], [90, 96, 'H0'], [97, 99, 'H0']]"
" Miller, and Alvin P.",H0,"[[0, 7, 'H0'], [12, 17, 'H0'], [18, 20, 'H0']]"
 Adams Sr.,H0,"[[0, 5, 'H0'], [6, 9, 'H0']]"
 His father was a Western Airlines executive.,None,[]
 His mother owned a bookstore.,None,[]
" The younger Adams attended Yale, like his father, and received a J.",H0,"[[12, 17, 'H0'], [27, 32, 'H1'], [65, 67, 'H1']]"
 D.,H1,"[[0, 2, 'H1']]"
 from Vanderbilt University Law School.,H1,"[[5, 15, 'H1'], [16, 26, 'H1'], [27, 30, 'H1'], [31, 38, 'H1']]"
 Adams joined the Foreign Service in 1967 and was appointed as the United States Ambassador to Djibouti in 1983 where he served until 1985.,H0,"[[0, 5, 'H0'], [6, 12, 'H1'], [13, 16, 'H1'], [17, 24, 'H1'], [25, 32, 'H1'], [66, 72, 'H1'], [73, 79, 'H1'], [80, 90, 'H1'], [91, 93, 'H1'], [94, 102, 'H1']]"
" His next ambassadorship was to Haiti, where he convinced Prosper Avril to relinquish power in a late night conversation held in March 1990.",H0,"[[9, 23, 'H1'], [31, 37, 'H1'], [57, 64, 'H0'], [65, 70, 'H0']]"
" In 1992, Adams was named ambassador to Peru, serving in that post until his retirement from the Foreign Service in 1996.",H0,"[[9, 14, 'H0'], [25, 35, 'H1'], [36, 38, 'H1'], [39, 44, 'H1'], [96, 103, 'H1'], [104, 111, 'H1']]"
" Adams also worked in Washington, D.",H0,"[[0, 5, 'H0']]"
 C.,None,[]
" , for what became the Bureau of Counterterrorism before his Haiti stint and was posted in Vietnam prior to all ambassadorial assignments.",H1,"[[22, 28, 'H1'], [29, 31, 'H1'], [32, 48, 'H1'], [60, 65, 'H1'], [111, 124, 'H1']]"
" There, he met his wife, Mai-Anh Nguyen.",H0,"[[14, 17, 'H1'], [18, 23, 'H1'], [24, 31, 'H0'], [32, 39, 'H0']]"
" Before their divorce, they had two sons, Lex and Tung Thanh, who died in the 1989 USS Iowa turret explosion.",H0,"[[13, 21, 'H1'], [41, 44, 'H0'], [49, 53, 'H0'], [54, 60, 'H0'], [77, 81, 'H1'], [82, 85, 'H1'], [86, 90, 'H1'], [91, 97, 'H1'], [98, 108, 'H1']]"
" Adams lived in Buenos Aires and Honolulu, then moved to Portland, Oregon in 2011, where he died on October 10, 2015, aged 73.",H0,"[[0, 5, 'H0'], [99, 106, 'H1'], [107, 110, 'H1'], [111, 116, 'H1'], [117, 121, 'H1'], [122, 125, 'H1']]"
" ""Alvin P.",H0,"[[7, 9, 'H0']]"
" Adams (1942–2015)"".",H0,"[[0, 5, 'H0'], [6, 19, 'H0']]"
 Office of the Historian.,H1,"[[0, 6, 'H1']]"
 Retrieved 18 October 2015.,None,[]
" Gregory Harry Adamian (September 17, 1926 – November 21, 2015) was the President Emeritus and Chancellor of Bentley College, now Bentley University.",H0,"[[0, 7, 'H0'], [8, 13, 'H0'], [14, 21, 'H0'], [22, 32, 'H1'], [33, 36, 'H1'], [37, 41, 'H1'], [42, 43, 'H1'], [44, 52, 'H1'], [53, 56, 'H1'], [57, 62, 'H1'], [71, 80, 'H1'], [81, 89, 'H1'], [90, 93, 'H1'], [94, 104, 'H1'], [105, 107, 'H1'], [108, 115, 'H1'], [116, 124, 'H1'], [125, 128, 'H1'], [129, 136, 'H1'], [137, 148, 'H1']]"
 He served as president of Bentley from 1970 until 1991.,H1,"[[13, 22, 'H1'], [23, 25, 'H1'], [26, 33, 'H1']]"
" Adamian was born in Somerville, Massachusetts to a family of Armenian descent.",H0,"[[0, 7, 'H0'], [20, 31, 'H1'], [32, 45, 'H1'], [61, 69, 'H1']]"
" He was raised in Brooklyn, NY and Watertown, MA, served as an Officer in the United States Navy in World War II, serving in the Pacific, and graduated from Harvard University.",H1,"[[62, 69, 'H1'], [70, 72, 'H1'], [73, 76, 'H1'], [77, 83, 'H1'], [84, 90, 'H1'], [91, 95, 'H1'], [141, 150, 'H1'], [151, 155, 'H1'], [156, 163, 'H1'], [164, 175, 'H1']]"
 He then studied law at Boston University.,H1,"[[8, 15, 'H1'], [16, 19, 'H1'], [20, 22, 'H1'], [23, 29, 'H1'], [30, 41, 'H1']]"
 Adamian joined the Bentley College faculty in 1955 and was named chair of the Law Department in 1968.,H0,"[[0, 7, 'H0'], [19, 26, 'H1'], [27, 34, 'H1'], [35, 42, 'H1'], [65, 70, 'H1'], [71, 73, 'H1'], [74, 77, 'H1'], [78, 81, 'H1'], [82, 92, 'H1']]"
 He also taught at Suffolk University.,H1,"[[18, 25, 'H1'], [26, 37, 'H1']]"
" As Bentley’s president, Adamian oversaw dramatic growth.",H0,"[[3, 12, 'H1'], [13, 23, 'H1'], [24, 31, 'H0']]"
" The college’s endowment increased from $385,000 in 1970 to $60 million when he stepped down as president, enrollment doubled, and the faculty grew from 42 to 350.",H1,"[[95, 105, 'H1']]"
 Adamian oversaw a building boom at Bentley.,H0,"[[0, 7, 'H0'], [35, 43, 'H1']]"
" After he became president in 1970, the college added 27 buildings, including residence halls, classrooms, and athletic facilities, constructing an estimated $70 million worth of infrastructure for the college.",H1,"[[16, 25, 'H1']]"
" During his tenure, Bentley reached multiple milestones and added numerous programs.",H1,"[[11, 18, 'H1'], [19, 26, 'H1']]"
 Bentley began granting bachelor of science degrees in all business disciplines as well as a bachelor of arts degree in 1971 when it became Bentley College.,H1,"[[0, 7, 'H1'], [139, 146, 'H1'], [147, 155, 'H1']]"
" Two years later, the Graduate School was established and offered a master of science in accountancy and master of science in taxation degrees.",H1,"[[21, 29, 'H1'], [30, 36, 'H1']]"
" Adamian also oversaw the founding of the Center for Business Ethics in 1976, among the first in the United States.",H0,"[[0, 7, 'H0']]"
" In 1990, the traditional business college began offering majors in English, History and Philosophy.",None,[]
" Upon retirement, he was named Bentley chancellor and president emeritus.",H1,"[[30, 37, 'H1'], [38, 48, 'H1'], [53, 62, 'H1'], [63, 72, 'H1']]"
" Since 1980, Bentley has awarded the Gregory Adamian Award for Teaching Excellence in his honor.",H0,"[[12, 19, 'H1'], [36, 43, 'H0'], [44, 51, 'H0']]"
" The Adamian Academic Center at Bentley University houses the Center for Business Ethics, the Cronin Office of International Education, and the Center for Languages and International Collaboration.",H0,"[[4, 11, 'H0'], [12, 20, 'H1'], [21, 27, 'H1'], [28, 30, 'H1'], [31, 38, 'H1'], [39, 49, 'H1']]"
" As chairman, vice chairman and treasurer of the Association of Independent Colleges and Universities in Massachusetts (AICUM), he was a strong advocate for increased financial aid.",H1,"[[3, 12, 'H1'], [13, 17, 'H1'], [18, 26, 'H1'], [31, 40, 'H1'], [41, 43, 'H1'], [44, 47, 'H1'], [48, 59, 'H1'], [60, 62, 'H1'], [63, 74, 'H1'], [75, 83, 'H1'], [84, 87, 'H1'], [88, 100, 'H1'], [101, 103, 'H1'], [104, 117, 'H1'], [118, 126, 'H1']]"
" He was also a member of many corporate and non-profit boards, including Liberty Mutual, the Massachusetts Higher Education Assistance Corporation, West End House and Inroads.",H1,"[[72, 79, 'H1'], [80, 87, 'H1'], [92, 105, 'H1'], [106, 112, 'H1'], [113, 122, 'H1'], [123, 133, 'H1'], [134, 146, 'H1'], [147, 151, 'H1'], [152, 155, 'H1'], [156, 161, 'H1'], [166, 174, 'H1']]"
 Adamian was a leading member of the Armenian-American community and an articulate spokesman on the Armenian genocide.,H0,"[[0, 7, 'H0']]"
" A founding director of the National Association for Armenian Studies and Research, he helped establish an endowed chair in Armenian studies at Harvard University.",H1,"[[2, 10, 'H1'], [11, 19, 'H1'], [20, 22, 'H1'], [23, 26, 'H1'], [27, 35, 'H1'], [36, 47, 'H1'], [48, 51, 'H1'], [52, 60, 'H1'], [61, 68, 'H1'], [69, 72, 'H1'], [73, 82, 'H1']]"
" In 1990, he received the Humanity Award from Facing History and Ourselves for his work as a spokesman for the Armenian-American community.",None,[]
 He has worked with other members of the Armenian diaspora to fund the education of students from Armenia who would otherwise not be able to attend American colleges.,None,[]
 Adamian served as chair of the Committee for the Resettlement of Armenians in the United States.,H0,"[[0, 7, 'H0'], [18, 23, 'H1'], [24, 26, 'H1'], [27, 30, 'H1'], [31, 40, 'H1'], [41, 44, 'H1'], [45, 48, 'H1'], [49, 61, 'H1'], [62, 64, 'H1'], [65, 74, 'H1'], [75, 77, 'H1'], [78, 81, 'H1'], [82, 88, 'H1'], [89, 96, 'H1']]"
" He was also the recipient of the Ellis Island Medal of Honor for lifetime contributions to education, business, law, and cultural and civic life in America.",None,[]
" He served on the boards of the International Armenian General Benevolent Union, St.",H1,"[[17, 23, 'H1'], [24, 26, 'H1'], [27, 30, 'H1'], [31, 44, 'H1'], [45, 53, 'H1'], [54, 61, 'H1'], [62, 72, 'H1'], [73, 79, 'H1'], [80, 83, 'H1']]"
 Nerses Seminary and the Armenian National Science and Education Fund.,H1,"[[0, 6, 'H1'], [7, 15, 'H1'], [16, 19, 'H1'], [20, 23, 'H1'], [24, 32, 'H1'], [33, 41, 'H1'], [42, 49, 'H1'], [50, 53, 'H1'], [54, 63, 'H1'], [64, 69, 'H1']]"
" In 1998, he received the medal of St.",None,[]
 Sahag and St.,None,[]
" Mesrob from Karekin I, Catholicos of All Armenians.",None,[]
" In 1991, he received an honorary Doctor of Laws degree from Boston University and an honorary degree from Bentley University.",None,[]
 Dr.,H0,"[[0, 3, 'H0']]"
" Adamian died on Saturday, November 21, 2015 at his home in Medford, Massachusetts.",H0,"[[0, 7, 'H0'], [16, 25, 'H1'], [26, 34, 'H1'], [35, 38, 'H1'], [39, 43, 'H1'], [47, 50, 'H1'], [51, 55, 'H1'], [56, 58, 'H1'], [59, 67, 'H1'], [68, 82, 'H1']]"
" He is survived by his wife, the former Debbie Murdza, and two sons, Gregory and Daniel.",H0,"[[22, 27, 'H1'], [39, 45, 'H0'], [46, 53, 'H0'], [68, 75, 'H0'], [80, 87, 'H0']]"
 Mihai Adam (3 July 1940 – 11 December 2015) was a Romanian football player.,H0,"[[0, 5, 'H0'], [6, 10, 'H0'], [11, 13, 'H1'], [14, 18, 'H1'], [19, 23, 'H1'], [24, 25, 'H1'], [26, 28, 'H1'], [29, 37, 'H1'], [38, 43, 'H1'], [50, 58, 'H1']]"
 Universitatea ClujRomanian Cup (1): 1964–65 Total matches played in Romanian First League: 353 matches - 160 goals.,H1,"[[68, 76, 'H1']]"
" Topscorer of Romanian First League: 1965, 1968 and 1974.",H1,"[[13, 21, 'H1']]"
 Inter-Cities Fairs Cup 1965–66: 4 matches - 1 goal.,None,[]
 Total Romania Under 23: 7 matches - 3 goals.,H1,"[[6, 13, 'H1']]"
" Total Romania ""B"": 1 match - 0 goals.",H1,"[[6, 13, 'H1']]"
" He has scored 160 goals in Liga I, being ranked 9th in the all-time scoring table, but he has never been capped for Romania.",H1,"[[116, 124, 'H1']]"
 Mihai Adam at RomanianSoccer.,H0,"[[0, 5, 'H0'], [6, 10, 'H0'], [14, 29, 'H1']]"
 ro (in Romanian) and StatisticsFootball.,H1,"[[0, 2, 'H1'], [3, 6, 'H1'], [7, 16, 'H1']]"
" Hazel Joyce Marriott, née Willett (9 July 1920 – 22 November 2015), known professionally as Hazel Adair, was a British actress turned screenwriter and creator of soap operas for radio and television.",H0,"[[0, 5, 'H0'], [6, 11, 'H0'], [12, 21, 'H0'], [22, 25, 'H0'], [26, 33, 'H0'], [34, 36, 'H1'], [37, 41, 'H1'], [42, 46, 'H1'], [47, 48, 'H1'], [49, 51, 'H1'], [52, 60, 'H1'], [61, 67, 'H1'], [92, 97, 'H0'], [98, 104, 'H0'], [111, 118, 'H1']]"
 She is best known for co-creating Crossroads with Peter Ling.,H0,"[[34, 44, 'H1'], [50, 55, 'H0'], [56, 61, 'H0']]"
